title_id,title,genre,authors,weekdays,length,subscriber,rating,views,likes,status,daily_pass,synopsis
7109,Duchess in Ruins,Romance,"Candlebambi, Saedle, Lemon Frog",MONDAY,16,446678,9.21,6000000,580162,ONGOING,False,"Edele Lancaster is the perfect noble lady who has been groomed for the job. But when her husband whom she married reluctantly commits treason, she is branded a traitor and becomes a slave. Distraught, she tries to kill herself to preserve honor as a noble lady, but her new master, Count Laslo Krissus prevents her from doing so. Will Edele be able to find freedom and happiness in her new life as Count Krissus’ maid?"
6107,The Reborn Young Lord is an Assassin,Fantasy,"swingbat, CoffeeLime",MONDAY,52,902338,9.51,24800000,1700000,ONGOING,False,"Cyan Vert, illegitimate son of the Duke and the empire's greatest assassin, is betrayed by the righteous brother whose shadow he's always lived in. But just before the fatal blow strikes his throat, Cyan awakes to find he's just a boy again. The young lord has been reborn, and this time, he's not going to live in anyone's shadow!"
7121,A Savage Proposal,Romance,"Lee yuna, team IRUKA",MONDAY,16,611027,7.87,6800000,379279,ONGOING,False,"When the ruthless Lord Tiwakan seizes the kingdom of Nauk, Princess Liene Arsac faces an impossible choice: marry her captor or watch her homeland crumble. But Lord Tiwakan isn’t just after power; he desires Liene, and his devotion stirs a mix of fear and undeniable attraction within her. With her former betrothed, Lafitte, still missing, Liene must decide whether to trust Tiwakan's promises or hold out hope for a rescue. As dangerous secrets come to light, Liene’s decision could change the fate of Nauk—and her own heart—forever."
4886,I'm the Queen in This Life,Fantasy,"Themis, Omin, Lefaljinf",MONDAY,121,1200000,9.57,92700000,8500000,ONGOING,False,"The Etruscan Kingdom is stained with blood when the king’s illegitimate son Cesare conspires with his fiancée Ariadne to usurp the throne from his half-brother Alfonso. Despite Ariadne’s devotion to the new king, her faith is shattered when she is betrayed by him and eventually murdered by her own sister, who wishes to be queen. To her surprise, Ariadne finds herself sent back in time to her 17-year-old self. As she navigates the perils and opportunities of palace intrigue, Ariadne must make the most of her guile and grit to ensure that her tragic future does not repeat itself."
7169,I Grabbed the Leash of the Blind Beast,Romance,"The greedy gatsby, PPANG, Kayeh",MONDAY,18,223470,8.72,4000000,328913,ONGOING,False,"When an average twenty-something wakes up in the battered body of a nameless extra from a romance novel, all she wants is to go home. But first, she’ll have to see the story through as Rona, the maid of Grand Duke Ileon, the novel’s hero who was blinded by poison. She just has to make sure the heroine restores his sight with a special flower so they can have their happy ending -- easy enough, right? With a plot gone awry, Rona’s dangerous past, and the grand duke’s affections, can Rona stick to the story?"
6756,The Perfect Contract,Romance,"TTUSOL, TAEZA, Kim Sohee",MONDAY,28,302960,9.54,7500000,555126,ONGOING,False,"Junwon, a perfect man, and Ju-i, a woman who knows her abilities and charms, strike an unusual deal: they will date with one strict condition—no falling in love. What starts as a simple arrangement soon becomes complicated as unexpected feelings begin to surface. Can they stick to their promise, or will emotions get the better of them? Dive into a world where love is both the goal and the enemy, and find out if their hearts will follow the rules or break free."
6679,Hidden Class Gravity User,Fantasy,"Nekoko, Chikuwa",MONDAY,32,271043,7.72,7700000,527998,ONGOING,False,"“Who needs a bandit, anyway?”
That’s the last thing Ikoma Ichinose, a bandit-class hunter, heard before he got kicked out of his party and ran into a monster that would kill him.
But he was given a second chance at life in the form of a time-turning pocket watch.
“Yeah, who needs a bandit?”
This time, Ikoma chooses to be a gravity master to have a shot at becoming the greatest hunter of all time."
6748,You Can't Kill Me: The Secret Bride of the Black Wolf,Romance,"HAEMIN, Kingkang, Yim Hye",MONDAY,28,395972,9.45,7500000,531394,ONGOING,False,"Yeonwu Chae, a talented yet lonely composer from Korea, finds herself and her family trapped in the underworld after a car crash. In her first life, she marries Hyojo, who ultimately kills her. In her second life, she takes revenge by taking her own life in front of him. But despite her desperate wish for an end, she’s given another chance at life. However, this time, instead of encountering Hyojo, she is discovered by Hwita, a mysterious man with a black wolf as his guardian spirit. Can Yeonwu break the cycle and find true safety in this treacherous underworld?"
6315,The Reason for the Twin Lady's Disguise,Romance,"Amamiya Ley., MONA",MONDAY,73,415178,8.56,22800000,1800000,ONGOING,False,"The Lowreis family was wrongly sentenced to execution for attempting to murder the royal family. As Linali Lowreis, the daughter of the family, is on the brink of death, she fervently prays for a second chance. Miraculously, she wakes up three years in the past, reuniting with her deceased family members. However, tragedy looms as her brother, Liam, is poised to attend the School of Poltis, the reason for the family's tragedy. She begs her father to send her instead of her brother, as she is better at sword fighting. Now, faced with a new identity and unexpected challenges, Linali must attend the School of Poltis in her brother's place."
95,Tower of God,Fantasy,SIU,MONDAY,651,4000000,9.86,1200000000,64000000,ONGOING,False,What do you desire? Money and wealth? Honor and pride? Authority and power? Revenge? Or something that transcends them all? Whatever you desire—it's here.
6465,The Extra's Academy Survival Guide,Fantasy,"Korita, GREEN KYRIN",MONDAY,41,205585,9.7,7300000,532726,ONGOING,False,"Ed Rothstaylor is a third-rate villain in a game, disowned by his family and kicked out of the dormitory for his misdeeds. One day, our main character wakes up as this very Ed, and realizes he must earn a scholarship so he can graduate and be set for life. Now living in the woods, he resolves to keep away from the protagonists, but four of the female leads just won't leave him alone. Not only that, his presence starts to change the timeline and events of the game! Can Ed help the story progress while staying out of the limelight?"
7122,At Your Mercy,Fantasy,"Team Lightsalt, Team honeybread, Early Flower",MONDAY,17,224544,8.56,3500000,266566,ONGOING,False,"Getting transported into a novel once? Unusual. Twice? Welcome to Ji-an Han’s reality. Her second possession lands her in the body of a noble lady with an unfortunate reputation—the court fool. While still adjusting to this twist of fate, the enigmatic Crown Prince Iskan enters the scene with an unsettling proposition: ""Take me as yours,"" he says, ""I’ll become your most cherished possession.""  Between her reputation as a fool and a prince whose motives remain unclear, can Ji-an navigate this complicated new reality?"
4011,The World After the Fall,Action,"singNsong, Undead Ttalgi, Undead Gamja",MONDAY,156,1100000,9.68,73500000,6000000,ONGOING,False,"Faced with imminent defeat and certain death, would you choose to run – or continue to fight for a doomed world? When mysterious towers appear across the world, summoning monsters that prey on mankind, this is the choice presented to the Tower Walkers – adventurers with special powers to fight the monsters. On the brink of death, they can choose to use a “regression stone” to return to the past for a second chance, though this decision places them in a separate timeline forever. Stubborn Tower Walker Jaehwan rejects this choice, choosing to fight for the original timeline, and learning shocking secrets about the Tower along the way."
6534,Monster Princess of the Snowy Mountain,Fantasy,"Lee Nakeum, seewater, suho",MONDAY,35,249060,9.14,7200000,614220,ONGOING,False,"Valerie Beloff, a princess in exile, decides to take her own life on her 19th birthday. Abused by her own mother and exiled for her mother’s crimes, she had to live in the freezing Makleroad palace by herself, and she somehow acquired the powers of an ancient monster - the power to freeze things. Hopeless, she seeks an escape in death… only to find herself before her cruel mother, yelling at her once again. Is she dead? Is she reliving a memory? When her mother strikes her, the throbbing pain lets her know that this is neither a dream nor a memory!

This series contains themes regarding child abuse that may not be suitable for all readers. Viewer discretion is advised. If you or someone you know is struggling or in crisis, please reach out for help at Crisis Text Line (http://crisistextline.org/)."
6298,My Beloved Oppressor,Drama,"LICO, Cersei",MONDAY,46,315017,7.55,11300000,707317,ONGOING,False,"When the hand that used to so lovingly hold Annette Rozenberg ends up being the one that causes the downfall of her family, Annette demands that Heiner Waldemar give her a divorce. But Heiner refuses, stating that he must see her miserable by his side, no matter what. At odds, the two continue a precarious relationship, only to be met with wounds of the past that bring them tragically together. ""This series contains themes regarding abuse and self-harm that may not be suitable for all readers. Viewer discretion is advised. If you or someone you know is struggling or in crisis, please reach out for help at Crisis Text Line (http://crisistextline.org/)."""
2052,Your Smile is a Trap,Romance,AENGO,MONDAY,149,1200000,9.78,85100000,10100000,HIATUS,False,"Ex-idol trainee Kiyu has lived his whole life adored by everyone for his good looks. But he dreams of ordinary high school life, so when he puts on glasses to blend in with his peers, he finds that making friends is a lot harder when you don’t have your looks to fall back on. Not to mention he’s also socially awkward, his new seatmate has a permanent scowl on her face, and his fans have tracked him down at his new school."
958,My Giant Nerd Boyfriend,Slice of life,fishball,"MON,",1069,2400000,9.73,824100000,74400000,HIATUS,False,"Having a boyfriend who's a full foot taller than you might seem adorable at first, but it usually just ends up causing a whole bunch of minor inconveniences. Follow Fishball as she navigates the Malaysian life with her 6'5"" geeky boyfriend."
6209,Fallen to Paradise,Romance,"BY, YoonJu, Wonderdream",MONDAY,52,310439,9.47,10400000,1000000,ONGOING,False,"Ange, the daughter of Duke Glaster, believes her life is all planned out as she is set to marry Philip Cardiner, the rightful heir to the throne. However, her plans are disrupted when Philip's brother, William Cardiner, schemes against him and removes him from the line of succession. In order to secure his power, William forces Ange to marry Aiden Fitzroy, an illegitimate child born between the emperor and a commoner. Will Ange learn to love the humble stranger she was forced to marry?"
6220,The Gardener in a Hunter World,Fantasy,"Tomozo, GITAE CHON, Sliber",MONDAY,48,251502,9.42,7900000,922164,ONGOING,False,"Jiha is living a relatively quiet life, gathering resources after raids and selling potions from his general store as a worker-class hunter. Little did he know, taking a nap on top of an ancient text would completely change his life. He is transported to a magical forest, where he gathers rare ingredients to create never-before-seen potions and meets mythical creatures that help him on his adventures. Soon, he starts to build up his abilities to become a skilled alchemist, and high-level hunters start to see him in a different light. How will Jiha make use of his newly acquired skills?"
5443,As If Love Doesn't Exist,Romance,"Hae-dam Kim, Yun-jo Kim, carbo (Hyo-won Do)",MONDAY,75,290902,8.07,14300000,1200000,ONGOING,False,"Siyeon had the rug pulled out from under her when she realized that everything in her life was a lie-- her parents are not her real parents, her fiance not really her fiance, and her cousin Eunhye is actually the birth daughter of this household. Siyeon is resigned to her misfortunes until Eunhye reveals to Siyeon that all of this was planned and orchestrated.
Swallowing her tears of anguish, Siyeon makes a fateful wish that brings her 10 years into the past where she may be able to change everything... or can she?"
5811,Ten Ways to Get Dumped by a Tyrant,Fantasy,"danmyeong, mapzzil, Seo Gwijo",MONDAY,71,498560,9.29,24400000,2200000,ONGOING,False,"Scarlett Arman is no ordinary lady, not just because she’s engaged to the emperor. Newly reincarnated as a character in a fantasy novel, Scarlett knows she is supposed to die a horrible death at the hands of her fiancé, Charleon Kalior. Determined to escape her fate, Scarlett decides to make Charleon break off the engagement... But why does he keep wanting to spend time with her?!"
5956,Weapon Creator,Action,"Cookie poet, Borem",MONDAY,51,259756,9.17,9800000,777251,ONGOING,False,"Here, try this sword. Junseo Shin is a master weapon creator doing menial jobs to keep a low profile in a world teeming with monster dungeons. But his habit of lending weapons to those in need exposes him to mega guilds and covert figures out to kill budding heroes from his past life. Can Junseo craft his way out of trouble and uncover the conspiracy that followed him to this life?"
7132,The Laws of Cultivation,Action,"AETHON, KrazeKode, Kisai Entertainment, Sauerkraut, Laurel Pursuit",MONDAY,14,108246,8.93,1200000,123723,ONGOING,False,"Lu Jie woke up in a world filled with scheming sects, arrogant young masters, and the mad chase for the immortal heavens. He wanted none of it. But his plan to escape the sect is interrupted by an old Alchemist's pills that heal him within moments—a magical cure. These medicines ignite the flame of curiosity to learn true magic in him, rekindling his love of discovery. Lu Jie sets out to study the immutable truths hidden within the world, and soon finds an all-new path of cultivation that could take him to the very top.

Art by Kisai Entertainment"
5551,I Stole the First Ranker's Soul,Fantasy,"LEE JUNG, EUDAM, Liquor AshTree",MONDAY,83,213358,9.71,11000000,1300000,ONGOING,False,"Moa Son, an ordinary office worker, wakes up in a dungeon in the middle of the night and awakens as a collecting hunter. After barely making it out alive, she falls into the same dungeon but gets rescued by the first-ranked hunter, Jihan Seo, and becomes bound up with him. Now he’s offering to make her strong on this one condition -- ""Promise me you will do your best to kill the bosses of all the dungeons that exist in the world.” Come again?"
7403,Game Master,Fantasy,"hibnkuma, Akaogi seki",MONDAY,9,64716,9.03,516863,47398,ONGOING,False,"""Gamemaster,"" a high school streamer, dedicated his life to beating the supposedly unbeatable game ""Hero's Destiny."" Finally succeeding after ten years, the realization that he's wasted his life is short-lived, as the game asks him to keep playing—only for him to wake up inside the game after he agrees, in the body of Callix Szcecin, the meek young son of a count. Together with Lyla, the maid and assassin hired by his stepmother who failed to kill him, Russel, the loyal knight, and Kraut, a young knight with much potential, Callix must survive the game again, in person."
7401,Hero of All Trades,Action,"KyuYoung, White Eagle",MONDAY,5,53362,9.08,253855,21493,ONGOING,False,"Gang-in Na wakes up in the year 2024 in the middle of South Korea with no memory of where or who he is.

Upon hearing a voice that sounds strangely familiar, he comes face to face with a robot named ACE (Autonomous Combat Entity), who informs him that he was once part of the Earth Federation Forces in the year 2082 and possesses a wide array of skills.

Gang-in decides to join forces with ACE to recover his lost memories and adapt to life on Earth, but the two look to be in for a bumpy ride."
7366,Absolute Reign,Action,"sidae, Y.H.JANG",MONDAY,9,61730,9.64,456914,43826,ONGOING,False,"Twenty years have passed since the Great War, but petty theft and exploitation have taken root during times of peace. The once dazzling world of Murim is a mere shadow of its former self, but one young enigmatic swordsman has sworn to restore Jianghu to its former glory. Will the noble principles of justice and loyalty prevail over corruption and greed?"
7406,Transference,Romance,Hyang-yu,MONDAY,8,72603,9.45,471830,47732,ONGOING,False,"Su-a, a college freshman in Creative Writing, struggles to understand and express her emotions, leaving her isolated from those around her. When she meets Taeyang, a second-year Sports Coaching student who can sense emotions through touch, their unexpected connection sparks a journey of discovery. Paired for a class assignment that involves a ""date,"" their bond deepens.
This is a story about a man who feels too much and a woman who feels too little, and their journey toward emotional growth."
6945,The Barbarian of Seoul Station,Action,"LICO, Jin Seol woo",MONDAY,17,65915,8.86,1000000,93928,ONGOING,False,"Cheoldu, a barbarian raised on Earth, lives a mundane life with his best friend Jintae. But when he sees an alien creature from his planet on the news, everything changes. Thrown into an apocalyptic challenge, Cheoldu and Jintae must adjust their lives in Nova, a savage world filled with goblins and ogres. Will the two conquer Nova’s perils and uncover the secrets that could change Earth’s fate? An epic tale of friendship, survival, and untamed adventure awaits."
7392,My Girlfriend is the Man!,Romance,massstar,MONDAY,9,39000,7.08,438120,43127,ONGOING,False,"Yunjae Park thought his relationship with his girlfriend, Ji-eun, was perfect--until one shocking morning changed everything. Ji-eun has mysteriously transformed into a man overnight! Can the two adjust to this sudden and earth-shattering change? And will Ji-eun ever turn back to who she once was?!"
7133,Little Hollow Café,Slice of life,"Vivian Ha, Sam_le_fou",MONDAY,13,91228,9.31,775519,124163,ONGOING,False,"When Mimi moves from the big city to quaint Little Hollow to take over her grandmother’s café, she expects a sleepy, quiet town… but nobody warned her about the fae lurking around every corner! While it’s every bit as cozy as her grandmother described it, it is also full of magic, secrets, and ridiculously cute people. Can Mimi uncover the magical secrets hidden within Little Hollow? And will she be able to pay rent at the end of the month?"
6201,It's Just Business,Romance,"youngha, gongsa",MONDAY,53,310065,9.47,8800000,875440,ONGOING,False,"“A love life? Give me a break.” A complete non-believer when it comes to romance, Eunho is focused on climbing the ladder at work. Smart with excellent social skills to boot, both her bosses and clients love her. But when a new hire suddenly appears in front of her and an old first love start to shake things up again, she can’t help but waver."
372,Wind Breaker,Sports,Yongseok Jo,MONDAY,523,2200000,9.92,572500000,25000000,ONGOING,False,"Jay's the perfect student. He's got straight As and he's the student body president. But after being coerced into joining the school's biking team, the Hummingbird Crew, he discovers a whole new world outside of studying. What new adventures will he face outside the comfort of his textbooks?"
6671,Dark Mermaid,Fantasy,DDOGAK,MONDAY,31,113487,9.7,2500000,333699,ONGOING,False,"She just wants to start fresh so she can graduate in peace. She just wants to leave behind all the bad memories - her sleepwalking, the trauma from being bullied at school - all of it. She did everything she could to keep to herself, but the class president, Hae-on, just won't leave her alone. One day, when Seulbi visits the local lake Hae-on recommended, she comes across something she never imagined seeing in her wildest dreams: a wild, dark mermaid.
This series contains themes regarding bullying that may not be suitable for all readers. Viewer discretion is advised. If you or someone you know is struggling or in crisis, please reach out for help at Crisis Text Line (http://crisistextline.org/)."
5549,Becoming the Monarch,Fantasy,"2631, doip, SOULPUNG",MONDAY,81,130745,9.56,6200000,596688,ONGOING,False,"When Chris, a one-armed mercenary with considerable experience and skills, swallows an artifact after an unlikely encounter with a savage looter, he finds himself back in the past as a 15-year-old lowly foot soldier... with both his arms. This time, he will not let his life take an unfortunate turn. This time, he will not let his friends die in vain. This time, he will use his knowledge and reach for the sky."
6991,To Die or To Fall In Love,Romance,HONEYB,MONDAY,17,91660,8.14,1200000,106423,ONGOING,False,"Isabella Woodville has always lived in her sister’s shadow, but her life takes a dark turn when she witnesses a murder at a masquerade ball. Targeted by a masked serial killer after receiving the notorious black invitation, she’s kidnapped and brought to a cursed estate. The twisted wager? Fall in love with him within 15 days, and she dies. Resist, and she survives. Caught in a deadly game of love and survival, Isabella must navigate the line between reality and the seductive fantasy she’s been thrown into."
6747,My Stepdaughter is a Bunny,Fantasy,"Karin Park, Sisse",MONDAY,31,126858,8.67,3000000,317059,ONGOING,False,"Gloria wakes to find that she has become the infamous evil stepmother of a cute little werebunny?! She has mysteriously entered a fantastical world of knights and werebeasts, but not as its main character. Now, she must prove that she is not the terrible person everyone thinks she is. It won’t be easy, but she has help. The World Tree’s butterfly guardians will aid her in winning the trust of her new husband and stepdaughter."
6887,My Girlfriend,Thriller,Park_ci,MONDAY,23,114969,9.47,2500000,192062,ONGOING,False,"One day, Jio is horrified to witness his girlfriend, Miho, devouring human flesh. How could this be happening? He's struggling to understand the events that transpired when Miho killed his close buddy. Jio flees in panic, only to run into his friend—whom he was sure was dead—still alive. Jio grapples with doubt, struggling to maintain his grip on sanity. Is Miho really the monster, or is everything just a horrible nightmare?"
6743,Skool of Street,Sports,Slanket,MONDAY,28,101867,9.69,1900000,222421,ONGOING,False,"DJ, drop the beat! When 18-year-old K-pop stan Suhyeon gets his heart broken, he turns to his actual true love, girl group sensation MainTainA–especially his bias, the group’s main dancer, Hailey. Leaving his bittersweet first relationship behind to transfer to Seoul, Suhyeon finds not only a spitting image of his bias in the school dance club member Hye-eun, who is supposedly Hailey’s younger sister, but also a new love in the most unexpected of places: the art of street dance! While helping Hye-eun overcome her stage fright, Suhyeon finds there may be more to life than love!"
5973,Mage and Mimic,Comedy,Feathermage,"MON,",88,95202,9.54,4600000,617310,ONGOING,False,"Muir the Mimic is tired of living her life in a dungeon. She wants to see the world and explore, and Rowan the Mage might just be her ticket out. But things are rarely that simple. When her goal is in reach a wicked curse tosses a wrench in things. But together maybe the Mage and the Mimic can find a way to have it all!"
5203,Heart Acres,Romance,"EA Denich, Colleen Coover, Paul Tobin",MONDAY,29,65372,8.89,1300000,167014,ONGOING,False,"Ben Crews has been kicked around by life one too many times. So when his grandmother offers him a place at her fancy estate, Heart Acres, he jumps on the opportunity to live a life of luxury. Imagine his surprise when he finds out the estate is crumbling, and he's been hired to fix it! And the twists don't stop coming when he finds out he has some unexpected hot and haunted roommates who seem a little too excited to have a cute guy around..."
7236,The Regressor Only Protects Me,Action,"MIDO, Joo Jinhong, Choe Wonjoon",MONDAY,12,62284,8.94,532437,55329,ONGOING,False,"“Let the Survival Game Begin!”Designated as a disruptive species in the universe’s ecology,
humanity must now participate in the ‘league’ under the watchful eye of the universal administrators. 
Jaehui Jin, sent back in time during the final stage of the game, arrives at one conclusion -
only Sion Kang has the power to lead humanity to victory."
6019,Mono and Mochi,Comedy,omumoo,"MON,",119,122183,9.73,7100000,1000000,ONGOING,False,"Having a cat is a huge responsibility, especially if that cat is Mochi! Mochi is chaotic, unpredictable, and hard to control--but at the end of the day, Mono wouldn't trade him for the world."
6330,Wail of a Dragon's Rage,Fantasy,"jordan, gegegek",MONDAY,44,105201,9.62,2200000,193598,ONGOING,False,"Ananta, a descendant of one of the First Six Incarnates, can transform into an unstoppable brawling dragon whenever anything stands in his way. And it's a power he'll need in his quest to exact revenge against the Wings Incarnate, a power-hungry deceiver that resembles a heavenly angel only in appearance."
4845,Love Cycle,Romance,QIN*,MONDAY,45,160825,9.31,4000000,367915,ONGOING,False,"Alicia's love life is perfect in her fantasy journal, but in reality she's desperate to get her crush's attention in school. When her journal leads her to a popular upperclassman, she gains an unexpected wingman—who only has more strings to pull as feelings start to unravel in everyone around them. After all, is love ever as simple as fairytales make it seem?"
