title_id,title,genre,authors,weekdays,length,subscriber,rating,views,likes,status,daily_pass,synopsis
4313,Time Roulette,Fantasy,"SN, Bae302, Choi Ye-gyun",Released,7,111140,9.1,2300000,246093,COMPLETED,True,"Poor law school student, Jeonghun Han, experiences a time slip via the time roulette machine he accidentally finds at his father's place. When he comes to his senses, he finds himself in the middle of a battlefield during the Joseon dynasty! But before Jeonghun can even process what’s happened, he’s approached by a messenger named Jun, who informs him that the only way he can go back to his time period is by completing the time roulette’s mission. Will Jeonghun be able to complete his mission and return to his time?"
5736,Rose and Sunflower,Romance,Paulina Márquez,Released,6,30955,8.73,612714,118754,COMPLETED,True,"All items keep memories…and Luisa has the power to relive those precious memories, just by touching them. When Jaz and Dalia become her new neighbors, Luisa will try everything she can to get her hands on the valuable memories contained within their items. However, Luisa will find out these siblings hide more than memories…
[This series contains themes regarding depression, mental health and potentially disturbing imagery related to trypophobia that may not be suitable for all readers. Viewer discretion is advised. If you or someone you know is struggling or in crisis, please reach out for help at Crisis Text Line (http://crisistextline.org/]"
3179,The Fabled Warrior,Fantasy,"Gosha, Solem",Released,8,190011,9.2,5900000,818622,COMPLETED,True,"Myeongok is just your typical 49-year-old mother living her life with her family--at least, that’s what she’d want you to believe. When two people from another world suddenly show up and ask her to help save their world, she refuses. She has a family now and can’t risk putting her life on hold... but will she be able to say no if her daughter is involved? Will Myeongok be able to find some way to save this other world and protect what’s dearest to her as well?"
2546,The Wendybird,Fantasy,"WmW, Thabfu, Tomas Santiagos",Released,7,161799,8.77,4600000,838841,COMPLETED,True,"Wendy Darling is a headstrong 17-year-old who dreams of escaping her humdrum life and strict family for a life of adventure, like the heroes in her stories. But what will she do when adventure actually comes knocking? In this retelling of Peter Pan, it’s Wendy who must save Neverland from Captain Hook and the strange beasts that torment its inhabitants."
4356,Heavenly Eats,Comedy,"Myoung rang, Allbba",Released,7,90470,9.72,2200000,354141,COMPLETED,True,"Dalsu, the son of God, has been kicked out of the afterworld and sent to Earth on a mission: find out what makes humans truly happy. Teamed up with his friend Lisa, who happens to be an angel and talented chef, the two start a food delivery service. Because what could make humans happier than delivery food? Only when the happiness meter on his motorcycle hits 100% will he be allowed to return. Will Dalsu be able to make it back to the heavens?"
2675,It Was All You,Sci-fi,"I SOON KI, OH5HO, Jake Lee",Released,7,313400,9.4,10900000,1300000,COMPLETED,True,"In a near-future Pyeongyang, clones have become an indispensable part of human life. Tasked to test XYZ Corporation’s latest prototype, biomedical engineer Dr. Yuri Lee is marveled by LPC-6, a physically perfect and intellectually superior clone designed for a single purpose -- to give unconditional love to his master. As she uncovers the depths of her unfaithful husband’s depravity, she finds solace in “Victor” and his extraordinary capacity for empathy. Will her desire for retribution and love set her onto a path of no return?"
3173,REAWAKENED MAN,Action,"Yongtaek Chae, Jaehan Kim",Released,5,221035,9.28,9900000,1000000,COMPLETED,True,"If there’s one thing Hwan Seok can’t stand, it’s witnessing injustice. But this time, getting involved with a pair of men targeting his next-door neighbor, Yerin, costs him his life. Three days after his murder, Hwan Seok wakes up…. alive! Armed with his newfound ability to be brought back to life after three days, Seok is determined to save Yerin but soon realizes he's gotten himself entangled in a plot bigger and more sinister than he originally imagined..."
3092,Moonlight Beauty Parlor,Drama,Nawa.,Released,7,170418,9.57,4800000,736164,COMPLETED,True,"Ina Yun is left without a job or home after she gets fired and her house burns down. Her luck takes a turn when Hyeondu Seo, owner of the Moonlight Beauty Parlor, offers her a place to stay as well as a job -- on one condition! Hyeondu suffers from insomnia, and it seems Ina’s presence is the only thing that allows him to sleep through the night. If she agrees to help him sleep at night, she can stay. As Ina spends more time with with Hyeondu, her heart begins to skip a beat when she sees how thoughtful he is with each of his clients. Is Hyeondu only keeping Ina around to help him sleep, or do his feelings run deeper?"
4449,Coffin Jackson,Drama,CTK,Released,7,61172,9.7,1100000,140467,COMPLETED,True,"Ever wondered where dead bodies go in the criminal underworld? That’s where Roman Piotroski comes in. A funeral director by day and cadaver disposal specialist by night, Roman makes a living processing and selling dead bodies for Fisher, a ruthless New Jersey gangster. After a falling out with Fisher, Roman finds himself recruited by a trio of misfit criminals in a hair-brained scheme to rob his old boss. Enter an extremely valuable corpse everyone’s dying to get their hands on, and it’s anyone’s game, with life and death at stake!"
3786,THE STAR SEEKERS,Fantasy,HYBE,Released,6,815570,9.79,9000000,1100000,COMPLETED,True,"It’s the age of magic; a world where magic idols prevail. In these extraordinary times, an ordinary idol group called Star One is suddenly gifted with magical powers. And with these magical powers, a mysterious enemy appears. The once unpopular idol group finds themselves tasked with saving the world. Will they be able to take on this enormous responsibility to restore peace?"
4351,Fray,Action,GO100,Released,7,108761,9.49,2900000,363530,COMPLETED,True,"In a world filled with demons, only knights blessed with miracles can fight against their tyranny. During a moment of desperation, Magpie was given a miracle, the one and only flame that can kill demons. But that very flame turns its owner into a demon that thirsts for ashes…
“Put in the firewood, if you don’t want to turn into a handful of ashes.”"
3922,Deadlife,Action,"Hooressha, Jinguk Lim",Released,6,138761,9.27,5600000,571376,COMPLETED,True,"Am I dead, or am I alive? After Seong-hun gets bitten by a zombie, he soon realizes that he hasn’t completely turned into one. Yes, his movements are slow, his urge to bite humans is strong, and his looks are completely different. But he remembers. He remembers the scent of his crush, he remembers how to read, and he remembers that he should protect his friends.
 
Unfortunately, the other intelligent zombies seem to disagree with the last bit..."
4000,Bloodhounds,Action,Jeong Chan,Released,11,112050,9.34,2300000,186050,COMPLETED,True,"Bark, bark! Yes, I aim to please and do your bidding. And I’ll certainly never bare my teeth – that is, as long as you don’t show your back. Because it’s a dog-eat-dog world out there. Whether you’re a judge, CEO, boss of the criminal underworld, or a nobody, it doesn’t matter. In the face of money, all are equal."
5842,Privacy Check,Drama,"liggy, wachi",Released,7,74269,9.4,1500000,183043,COMPLETED,True,"Society is corrupt, but no society is as corrupt as Hanbit High School. Chaseong, a student at the bottom of the school’s social hierarchy, struggles to survive… until he unexpectedly gains a mysterious ally who claims that together, they can uproot it all. But how? No one knows, but one thing is certain, Chaseong’s secret WeTube channel is about to go viral."
370,Duty After School,Sci-fi,Ilkwon Ha,Released,11,174556,9.68,7400000,516907,COMPLETED,True,What would you do if your school's extracurricular activity was a mandatory military service amidst an actual war? A class of students is turned into a platoon of soldiers to fight against unknown slime-like objects.
6722,Glacias,Fantasy,"Yaruno, Nawa",Released,14,44275,9.41,637389,94874,COMPLETED,True,"Dragons don't seem scary when you've been raised by one, but how do you convince the rest of the world their fear is misplaced? Determined to create a city where humans and dragons can live together, Juka sets out with his dragon Lyth to challenge traditions and history itself. Can the everlasting hatred between two kinds be broken by a single boy and his dragon?"
4077,Nina's Magic Chest,Thriller,RD,Released,25,61770,9.23,4600000,649313,COMPLETED,True,"Nina is living on her own for the first time and failing hard at adulting. She can’t hold down any part-time jobs, let alone get hired as a full-time employee anywhere. One day, she finds a magic chest on the street that seems to make wishes come true. What started out of curiosity and fun, quickly takes a dark turn as she becomes entangled with strange people and inexplicable events. Nina will have to face the butterfly effects of her seemingly innocuous wishes!
​"
4210,Time and Reason,Romance,Colabear,Released,7,140783,9.0,4300000,451357,COMPLETED,True,"10 years ago, Banji and Baek-yeong, along with his three younger siblings, spent their happiest moments together. It seemed like time would last forever. But one day, it all came crashing down and Banji and Baek-yeong parted ways. 10 years later, the two fatefully meet again as coworkers, but Banji pushes Baek-yeong away. As for Baek-yeong, he is determined to reconnect with Banji because he doesn’t want to lose her again. Will Banji and Baek-yong be able to rekindle the relationship they once had?"
4117,Who's Mr. President?,Drama,"S.M.S, KING Productions",Released,5,185817,9.79,6700000,811864,COMPLETED,True,"Chiara is a scholarship student starting her first year at Krisopras High School, an elite private school for the rich and famous. A commoner compared to her peers, Chiara’s first day is full of surprises. But the real shock comes when she ends up being chosen as the only ""public"" member of a private group dedicated to serving justice for the student body. Will she be able to cope with the life of a student at Krisopras High School along with her newfound position, and who is this ""president"" shrouded in mystery?"
1878,Rot & Ruin,Horror,"Alempe, Jonathan Maberry, Kylie Hunsinger, ITSURYUU, Jean, WmW",Released,9,358040,9.57,13800000,1500000,COMPLETED,True,"Benny Imura and his friends must navigate a post-apocalyptic zombie-infected America in which teenagers are forced to find labor or face starvation. When Benny grudgingly joins his annoying older brother Tom as an apprentice zombie hunter, he soon discovers that almost everything he believed about his sheltered life is wrong--and zombies aren’t the greatest thing to fear in the Rot & Ruin.

Based on the novel Rot & Ruin by Jonathan Maberry."
344,Winter Woods,Drama,"COSMOS, VAN.J",Released,18,759202,9.81,71400000,3900000,COMPLETED,True,"A few thousand years have passed since an alchemist created Winter. Winter begins living with Jane, a writer, in exchange for telling her his story. From their interactions, Winter begins to learn the meaning of being human, and without realizing it, Jane begins to see a man who has changed her life in more ways than she could imagine."
6596,The Mushroom Girl,Romance,fiosketches,Released,7,36326,8.64,405710,63713,COMPLETED,True,"As the heir to the biggest tech company in the world, Darian has it all: fame, fortune and a gorgeous girlfriend. Still, the thing he yearns the most is the one he doesn’t have: happiness. Will that change when he gets the chance to help Amy, the mysterious girl that lives in the forest? A magic story about love, loss and finding a place to belong."
3363,Archie Comics: Big Ethel Energy,Drama,"Keryl Brown Ahmed, Siobhan, Archie Comics, WmW",Released,9,379180,7.72,28000000,3000000,COMPLETED,True,"She used to be the laughing stock of Riverdale. Now she’s a successful New York journalist with a DGAF attitude.

After graduating from Riverdale High, Ethel couldn’t get away from her hometown--and onto her chosen career path--fast enough. When the Mayor of Riverdale pays her handsomely to write a history of the city, she can’t wait to return to take down Archie, Jughead, Betty, Veronica, and all the other Riverdale natives who made her life hell all those years ago. The only thing she forgets to consider is... maybe they’ve all changed, too."
4120,Happiness,Action,"Jin Cheol-soo, Park Si-hyun, Jung Seok-hyun",Released,5,115655,9.3,3100000,302057,COMPLETED,True,"Saebom, a Sergeant of the Special Forces, and Ihyeon, a Detective Sergeant of Saeyang Police Station, are high school friends who enter into a marriage of convenience so that they can qualify to buy an apartment together, while a mysterious and seemingly contagious virus tears through their city of Saeyang. Saebom and Ihyeon move into their dream home only to find that the new virus that turns people violent and thirsty for blood has come knocking at their door."
3482,ANT,Thriller,Jaehee,Released,5,91669,9.14,2000000,168899,COMPLETED,True,"They live under our feet... 
Sihwan Kim decides to stay at Dabin Park's house for a while. Little does he know that unidentified ants dwell below...
Through an experiment, a monster-like ant creature is born and begins to kidnap people. Will Sihwan and Dabin, who are now caught up in the incident, be able to escape after twists and turns?"
4213,Loaf App,Drama,"Yugyeong, Gulrim",Released,4,124136,8.08,2500000,284030,COMPLETED,True,"When country boy Yewang enrolls at the prestigious Yeonghwa Academy to follow his favorite idol Jena Lee, he expects a life of glitz and glamor among Korea’s future elite. But he’s in for a rude awakening when he finds himself at the very bottom of the social ladder upon his arrival and targeted by the school bullies. Not only that, bullying seems to be normalized at Yeonghwa Academy, with victims designated as “Loafs”, who are essentially free targets. Finding allies along the way, Yewang sets out to fight back against his bullies and the school’s strict hierarchy."
1850,Kind of Love,Romance,"Various Artists, WmW",Released,9,636189,9.63,31400000,3000000,COMPLETED,True,A collection of short stories exploring the many kinds of love we experience in our lives
3600,Our Time,Drama,"seaweed candy, Leewol",Released,3,118472,9.62,3100000,512337,COMPLETED,True,"After an unexpected accident, Mirae falls into a coma. But for some reason, she keeps waking up at a time when everyone else’s stops. With this miraculous power, she tries desperately to wake up from her coma and return to everyone else’s time.
Meanwhile, Mansu, a rebellious teenage boy with the ability to stop time, flicks his fingers daily to get away from family drama and troubles at school. However, he meets Mirae walking around in a time where everyone should be completely still.
Will Mansu be the key for Mirae to come back to our time?"
3236,She Bites!,Slice of life,"MandaRat, NoChanJoo",Released,8,65390,9.57,1600000,263940,COMPLETED,True,"Hanna, a 28-year-old college student, is getting her second undergraduate degree to become a lawyer. However, she soon realizes that she was supposed to go to a law school instead of getting a second undergraduate degree. Out of money and out of place, she joins a start-up business club to make money. Working with four other slightly weird teammates, they are starting a pet clothing business together. This feels a little funky, but everything will be fine... right?"
4005,Ghost King,Action,"SON GOHOO, PARK JINSEOK",Released,3,157337,9.36,4800000,437272,COMPLETED,True,"What if the world was divided into people with martial arts powers and people without? Taeyeon Kang was one of the lucky few born with such powers. He enrolls in Murim Police University, a special school for those with powers to stand on the side of justice… but he has a secret of his own. He’s here to uncover the truth behind his father’s disappearance as well as seek protection from the Evil Murim Faction which is after his family’s secret book of martial arts techniques. At the same time, the legendary Ghost King makes his grand return, years after his mysterious disappearance. Just who is this masked anti-hero?"
2247,Beetle Hands,Horror,Herhumanist,Released,8,146875,9.67,3100000,452745,COMPLETED,True,"Welcome to the Heartland, a nightmarish realm where your own memories come back to hunt you -- literally. Dragged into the Heartland by the terrifying Beast that lives inside it, Matthew must survive long enough to free himself and his best friend Kenma before the Beast consumes them both. Better run fast, Matthew, before the Beast can catch you."
2403,FLOWAR,Sci-fi,Hongjacga,Released,5,91543,9.49,2200000,289158,COMPLETED,True,"“Wake up.” These are the words Sora Han hears right before her heart stops and then begins to beat again. The first and only person in the world to successfully have a plant heart transplant, Sora has felt an inexplicable pull to go to outer space ever since her operation. At 25 years old, she finally gets the chance. But why does everything on the planet she travels to seem familiar? Sora learns more about herself on this journey than she could have ever imagined."
5716,The End of a Relationship,Thriller,Yong-Ki Kim,Released,11,32279,9.27,795140,98159,COMPLETED,True,"Gyuheon goes on a vacation with his girlfriend, Da-eun, to a guest house hidden in the countryside. However, from the moment they encounter the owner of the guest house upon their arrival, everything starts to fall apart. As horrible events start to unfold along with dreadful encounters, they continue to fall deeper into the darkest pit of hell... It’s time to put an end to everything."
5737,Diving Into Love,Romance,ILGONG,Released,7,44602,8.27,846872,79685,COMPLETED,True,"When her father tries to force her into financial independence and out of her bed, Taepyeong accidentally runs into a man who can… turn into a fish?! To make matters more complicated, a cunning hotel president plots to take away her seafood restaurant. Now, Taepyeong has to find a way to save her restaurant and her love life all at the same time!"
1677,Meow Man,Comedy,Olso,Released,7,316359,9.69,31000000,4200000,COMPLETED,True,"What if your dream date turns out to be... a cat? Such is the dilemma for Bonnie, a young woman who wanted love and ended up with Claude, a highly needy half-man-half-cat instead. Will they be able to make it work? Is sharing the litterbox going to be a huge problem? And what ARE her friends going to think? Read Meow Man to see how this big ball of yarn unfurls."
4211,Apocalypse Live,Horror,Cho Seok,Released,6,81528,8.58,2200000,187559,COMPLETED,True,The apocalypse is live. Tune in before the world ends! Ordinary high-schooler Huiwoo livestreams a chain of bizarre events that occur throughout Damyeong City. But what started out as innocent social media activity leads Huiwoo to discover a far more sinister story behind these incidents…
293,DEAD DAYS,Horror,DEY,Released,13,236677,9.66,16000000,612869,COMPLETED,True,"Beginning on the 4th day after a zombie virus broke out, this is a story about the will to live, human instincts and our selfish desires. A thrilling tale about the survivors of a zombie apocalypse."
6021,City Vamps,Romance,seashell_arts,Released,9,72775,8.69,2000000,279517,COMPLETED,True,"Adam, a half-vampire living with his father in the city, eagerly anticipates gaining full vampire powers at a certain age. However, upon turning 17, he grapples with the challenges of controlling his abilities and navigating complex emotions, such as love…"
1340,Moon You,Sci-fi,Cho Seok,Released,10,167307,9.71,7700000,813201,COMPLETED,True,"After an asteroid destroys Earth, Moon Yoo unintentionally becomes the last person in existence, or so he thinks. Stuck on a research facility on the moon, he struggles with being the last person alive. Little does he know that humankind is watching his every move from Earth."
4320,Divine Circumstances,Romance,"Yusoo, Jeong Aro, Kim lum, MIN",Released,5,127088,7.42,2900000,272860,COMPLETED,True,People have red threads that tie them to their destined significant other. Are Ryeong and Taeseong going to be tangled up by their red threads? Are they just enemies that couldn’t stop bickering? Or are they going to be lovers bound by the red threads?
3089,The Nuna at Our Office,Drama,"WasakBasak, JANE, Palmeiro",Released,7,252070,9.2,7300000,824303,COMPLETED,True,"When Manager Son is sent to a new department, his boring office life takes a sweet turn. There, he meets Manager Ahn, an older colleague whose competence and charming aura leave him in awe. But as Manager Son grows closer to her, he realizes there’s more to her strong, independent front than meets the eye. And soon enough, he begins to understand why office crushes can get complicated."
5987,The Seductive Wife,Drama,"Yoon Soda, RedpeachStudio",Released,53,692217,7.55,20800000,647171,COMPLETED,False,"This series contains themes regarding domestic abuse, sexual content and themes that may not be suitable for all readers. Viewer discretion is advised.

Some marry for love, and some marry for convenience. In Ijae’s case, she marries Yuheon, the son of a business tycoon, to save her family after her father ends up in deep debt. Even though their marriage is contractual, Ijae feels an intense attraction for the cold and calculating Yuheon. Every night in her dreams, she imagines what it would be like to make love with him… until one day, the two end up actually sharing a passionate night together. But will their physical chemistry be enough to build a genuine connection? Or will Ijae remain a pawn in Yuheon’s game?"
5096,Unraveling Rumors,Romance,"T.Green, bbchu",Released,7,98573,9.11,2000000,207459,COMPLETED,True,"“Seo-un University’s D***** A* Exposed!” Dareum An goes from a goddess to a social pariah overnight, all because of those five words, a baseless rumor, and an anonymous forum app for college students called EvCam. Just when she feels ready to give up on everything, Muyeol Lee appears and offers to help her find the person who ruined her reputation. Can Dareum clear her name and regain her perfect life? More importantly… can she really trust Muyeol?"
3577,Flawed Almighty,Supernatural,"Carnby Kim, RH Song",Released,7,247595,9.64,15700000,2200000,COMPLETED,True,Do good or go to hell. The conditions of his new curse seem simple enough for once-hopeful hoodlum Jeonji Kim. Or so it seems when his perky guardian angel shows up on his doorstep one day and heals his limp. But will simply going through the motions of helping people be enough to appease a petty god with a grudge?
82,About Death,Drama,"sini, Hyeono",Released,6,146825,9.82,6500000,408873,COMPLETED,True,"At the border between life and death, someone is waiting for you... ""How would I had time to think about death when I haven't yet figured out life...?"" About Death is a collection of poignant conversations on the inevitable rhythm of life and loss."
80,The Cliff,Thriller,Sungdae Oh,Released,2,85691,9.32,2300000,123010,COMPLETED,True,"Tensions rise as two men wait for someone to save their lives after falling and getting stranded on the cliffside of a dangerous hiking trail. When days pass with no indication of help, the cliff becomes a stage for confrontation, violence, and madness."
4674,Fingers,Thriller,"jeongsik Park, Ssuljak",Released,3,70185,8.79,1600000,179830,COMPLETED,True,"One finger in exchange for one hint -- this is the price to pay to solve the puzzle. Eight creators of an entertainment news app find themselves in a locked room after a drunken party to celebrate their success. They’re given a puzzle to solve by 7 AM the next morning, or else everyone dies. However, solving the puzzle isn’t easy. They’re desperately in need of hints, but at the cost of cutting off their fingers. Who is their mysterious assailant and can they escape in time?"
3042,Tenants from Another World,Fantasy,"kiki, E-um",Released,7,221384,8.71,4000000,523099,COMPLETED,True,"Haeseo Han is an ordinary, hard-working office worker whose main concerns revolve around being overlooked for promotions, smug colleagues, and workplace stress. That is, until she finds herself intertwined in a prophecy that will determine the fate of a fantasy world! In the realm of the Beiston Empire, Haeseo is seen as the oracle who will determine the next successor to the throne and bring peace to the country. Hoping to win Haeseo’s favor and become the next emperor, the three charming yet eccentric princes of Beiston cross over into Haeseo’s world to begin their lives together as housemates!"
3481,Blade of the Phantom Master,Action,"Inwan Youn, Kyungil Yang",Released,9,60124,8.57,2000000,244885,COMPLETED,True,"Long ago, there were royal inspectors in a country called Jyushin. They disguised themselves as shabby travelers and passed through towns, big and small. The duty of these inspectors was to find corrupt officials and punish them. 
But Jyushin has fallen. The world is corrupt, and no one answers the cry for help from the suffering people anymore. However, one royal inspector remains, roaming the lands..."
