title_id,title,genre,authors,weekdays,length,subscriber,rating,views,likes,status,daily_pass,synopsis
6150,CHILDREN OF VAMFIELD by DARK MOON,Fantasy,HYBE,SUNDAY,49,255990,9.84,5700000,504453,ONGOING,False,Seven boys live under the care of Ms. Marge at Vamfield House. Their peaceful lives are shattered one day after they stumble upon a secret room...
1216,CARL,Slice of life,Hussein Traboulsi,SUNDAY,241,426162,9.75,57500000,5500000,ONGOING,False,Carl is a robot psychiatrist that suddenly becomes sentient. He starts longing to be human but his creator and father figure Dr Alda prevents him from showing his feelings out of fear of losing him. More challenges arise when Alda’s arch nemesis sets out to destroy them both.
4434,Dreamwalker,Action,Magikfire,SUNDAY,57,95086,9.7,2500000,301064,ONGOING,False,"Where do our souls travel when we dream? For the boy named Spider, dream worlds become reality when Nightmares come to steal the soul of the one he loves. Crossing dimensions to get her back, Spider must navigate a tricky web of fates as he joins the dreamwalkers."
6538,I'll Give You the Most Rotten One,Romance,Yoonda,SUNDAY,36,134741,9.22,2900000,179587,ONGOING,False,"Ten years of relationship go down the drain when Haeru discovers that her loving boyfriend, Se-o, spent the night with another woman. What begins as a series of small misunderstandings snowballs into something much bigger as the college sweethearts wade through love, temptation, and workplace drama. Well, what better way to get back at her cheating boyfriend than to take the most rotten revenge ever?"
7005,Void Man,Action,KEON,SUNDAY,19,69332,8.89,836237,62607,ONGOING,False,"Gods have descended upon the world, and Da-il's ready to drag them all to hell. After the lives of his loved ones were taken by the gods, Da-il offers his soul in exchange for the powers of the very killer of gods, the Void."
5173,Reloaded into the Other World,Fantasy,"Yim Kyung Bae, WM, ChoCho",SUNDAY,100,177914,8.88,7200000,595773,HIATUS,False,"When Emperor Rustanard of the Rusclan Empire summons the Otherworldly Savior from another world to fulfill a prophecy, he doesn’t expect to find 16-year-old Sihan Seong. The emperor casts him out, only to have Sihan return with a party of six warriors to defeat the so-called “Mad Emperor” and set the Rusclan people free. Just when victory is within Sihan’s grasp, he is betrayed by his teammates and sent back to his own world. 10 years later, Sihan returns to the Terranor Continent and finds an unlikely ally in Alita, the daughter of Rustanard…"
5715,The End is a Game to Me,Action,"HOOPA, Woo Jin Choi",SUNDAY,75,150819,9.58,5200000,516801,ONGOING,False,"Cheonsu Go is a shut-in NEET whose day-to-day is playing games and streaming to his one viewer. One day, he finds himself thrown into the midst of a survival game as a player character. The only clear condition for the game is to survive. The camera is rolling, and the 24/7 broadcast of his fight for survival begins now!"
6411,Reflection of the Soul,Romance,Magovi,SUNDAY,44,69867,8.55,1800000,173646,ONGOING,False,"Annie is a lonely girl who is afraid of mirrors, while Liam is a well-known model and actor. It may seem unlikely that two people with such different lives could relate to each other, but sometimes, people's external appearance doesn't reflect their true souls. This is the story of two broken hearts and their journey toward self-acceptance and love.

This series contains themes regarding bullying, self-harm, and mental health and may not be suitable for all readers. And if you or someone you know is struggling or in crisis, please reach out for help at crisistextline.org."
6883,Humanoido,Heartwarming,hyung ju,SUNDAY,23,44925,9.62,794358,78870,ONGOING,False,"Meet Ido Noh, a shy first-year high school student with a severe stutter that makes talking to people nearly impossible. Her life changes when she meets Se-i Ryu, a robot with a mysterious past and a quest to reclaim his lost memories. Can Ido find her voice with this unlikely friend, and will Se-i uncover the secrets of his origin?"
5518,Maru is a Puppy,Comedy,Mojo,SUNDAY,81,76231,9.83,3900000,604510,ONGOING,False,"Woori’s 5-year old poodle mix, Maru, has turned into a human —  a 5-year old little girl, that is! Now Woori’s gone from pet owner to big sister, and it’s her job to keep Maru out of trouble. Human Maru has the same endless curiosity and playfulness of a puppy, but now she can walk into grocery stores, go to kindergarten, and check this out — hold things with her opposable thumbs. Being human rules!"
6746,The Last Passage,Horror,"RD, KIRO",SUNDAY,28,65691,9.46,1000000,125545,ONGOING,False,"Hell? Far from it. After all, isn't this what you wanted?
After choosing to end his own life, Huiseo Yun awakens adrift on a wooden raft in a bleak, desolate ocean. Attacked by a monstrous creature that defies reality, he questions if it's a dream... but his instincts scream otherwise. Just when all seems lost, he is rescued by a mysterious woman who resembles a grim reaper. As he catches his breath, Huiseo asks: am I in hell?"
6990,The New Hire's Secret,Romance,"Dasim, Gogigamza, blancD",SUNDAY,18,35862,7.38,532603,34834,ONGOING,False,"With a handsome face and manners that would put a diplomat to shame, new hire Hyeonu Lee is a sight for sore eyes to Senior Manager Iyeon Shin when he walks through the doors of Hanshin Worldwide. Feeling like she’s won the lottery, Iyeon is looking forward to her company life alongside this polite and hard-working young man—

“Hey, Iyeon. Get this done by tomorrow.”

Hyeonu is no regular employee; he’s the son of the CEO. And as he begins to show his true nasty nature behind closed doors, Iyeon begins wondering what she did to deserve him."
6077,My Super Eldritch High School Melee Festival,Comedy,HannesRadke,SUNDAY,30,53734,9.4,834861,127803,ONGOING,False,"In just a few days, the Eldritch Meleé Festival at Cambia High School will begin. Fighters of the Four Houses will test their skill in the martial and metaphysical arts. Leyla and her BFF Tama want to spend the day like normal school girls for a change, but Leyla finds two suspicious love letters in her locker..."
6668,The Superhuman Era,Superhero,Supp,SUNDAY,35,63277,9.67,1100000,103228,ONGOING,False,"When the xenoterran invasion began, the only ones who stood between us and the monstrous creatures were the superhumans. 
But while some chose to use this power for good, others had more sinister intentions.
Kang Lim is a high school student with a secret -- he’s the vigilante superhero known as the White Cap, fighting back the mysterious monsters whenever he can.
But the world he protects isn’t what it seems -- there is more to the emergence of the xenoterran than meets the eye, and strange forces are at play in the shadows..."
6132,Return of the Gods,Fantasy,HONGMUJE,SUNDAY,55,129259,9.22,2800000,255902,ONGOING,False,"Uju Hyeon dreams of living the ordinary life of a high school student, but his dream will never come true as he possesses special powers that others don’t have. One day, after being chased by an evil spirit, he is taken to the School of the Tiger and learns that he has a dragon orb in his body. Will Uju be able to protect himself and the dragon orb from evil spirits?"
3654,Samurai no Tora,Action,"Brandon Chen, Jose Fernandez",SUNDAY,28,57848,9.03,898409,108746,ONGOING,False,"In the year 2200, the age-old tradition of samurai has evolved into a riveting fusion of sport and spectacle. Tokyo stands as the thrilling epicenter of this melee, its cityscape an open arena for licensed samurai to engage in intense duels, their clashes recorded and broadcasted for the world to witness.

Young and ambitious Tomoe Harada finally seizes her samurai license, stepping into this vibrant battlefield. But her dreams extend beyond simply being one of the world's leading samurai. She seeks to challenge a certain someone...

However, Tokyo teems with formidable challengers, each wielding unique fighting styles that can shatter dreams of glory. Can Tomoe and her companions rise to the challenge and etch their legacy in the chronicles of samurai history?"
6884,Asura,Action,"Giun Ryu, Mun Jeong Hoo",SUNDAY,21,26446,9.54,365837,41632,ONGOING,False,"Once there was an emperor’s vassal who journeyed abroad to discover the secret of immortality. A lifetime went by, and the emperor and empire fell to dust. The vassal, now known as Chief, returns to the realm, bringing with him a boy of mysterious origin and immense power named Asura. In this unfamiliar world, Chief and Asura must reckon with peril and unrest among martial arts sects ruled by the nefarious Fort Sovereign. One thing, however, is for certain: the realm will never be the same."
6145,Back From Black,Action,"M3, NADNF",SUNDAY,50,93489,8.58,1900000,135896,ONGOING,False,"Zak, the greatest assassin to ever live, gets betrayed and killed, only to wake up two centuries later in a bioengineered body. Having been unable to save his wife and keep his promise to her, Zak uses his new body, and the Nano-technology hidden within, to navigate through a new futuristic age of assassins and seek out the ones responsible for his tragedy."
4442,It Rains on Precious Days,Romance,"RYO., YABOMI",SUNDAY,140,112732,9.0,4800000,694710,ONGOING,False,"Kyoko always thought she would end up getting married to her long-term boyfriend Kenichi. However, reality hits her like a ton of bricks when he decides to end their relationship and move to Kyushu without her. At the age of 24, she starts a new life in Tokyo, where she crosses paths with Yoichi at her workplace. His warmth tugs at her heart, and despite their 17-year age gap, she falls in love with him. However, fate has other plans, and when two other men shake up her love life, she must make the biggest decision of her life."
4866,Designated Bully,Action,GRIMZO,SUNDAY,6,627144,9.24,24600000,2200000,ONGOING,True,"After dropping out of high school, Daegun Kwon is working part-time at a convenience store while preparing to get his GED. After being harassed by a group of punks during work and teaching them a lesson, Daegun is approached by a woman from the Education Foundation about a project called “Designated Bully”. After being offered another chance at a normal life, Daegun accepts the offer and attends school to perform his one duty as the designated bully: To take down the other bullies, and restore order to the school."
5545,How a Goddess Wins Over Tigers,Romance,"Awan, Chungla",SUNDAY,82,102477,9.43,3500000,373164,ONGOING,False,"After being betrayed by her lover, the sun god Moha meets a bitter death--but soon finds herself thrust back into her past in someone else's body. Two tiger spirits from Moha's past vie for her affection as she struggles against the looming tragedy that once ripped her heart--and the world--apart.
As Moha navigates this unfamiliar world alone with no divine power, will she be able to change the tragic course of her life and find true love?"
6414,My Life as a Loser 2,Drama,"PTJ COMICS, Peanut, SW Jeon",SUNDAY,42,39608,9.38,898408,109451,ONGOING,False,"This isn’t the life I wanted!!! After reliving high school as Jinu, the boy he once bullied, Ancheol is now a new person. But his new life takes an unexpected turn. Once again, he is sent back in time to live as Jinu. But this time, Jinu is also back... as Ancheol!"
5122,Moonchild,Horror,OHNYUN,SUNDAY,102,109309,9.78,3800000,446617,ONGOING,False,"Since childhood, Bak-ha has been able to see ""things"" that others can't. On the first day at his new school, Bak-ha meets Jindo, and due to the sickeningly sweet smell Bak-ha has, Jindo notices he is different, just like himself. As they get closer, Bak-ha finds out that he was the moonchild, the mythical creature who ruled the spirits in the past, and realizes that this is why the ghosts and demons are after him."
2615,The World is Money and Power,Action,"Dongwoo Han, Dohee Lee",SUNDAY,203,257425,9.61,13900000,1400000,ONGOING,False,"Gunwoo Dahn has vowed to overthrow the status quo of the dysfunctional high school he recently transferred to, where rich and powerful third-generation chaebol heirs call the shots and gambling runs rampant. But does Gunwoo have what it takes to beat the odds, defeat the Taekyeong Oh Family, and restore law and order to his high school?"
5554,Mr. Magic Man,Romance,"RD, Tyrs, Simon Youk",SUNDAY,79,136296,8.98,3700000,287354,ONGOING,False,"Maseong is a celebrity magician with a profound secret: he can actually move things with his mind! When he runs into a mysterious young woman with amnesia claiming to know him from a past life, Maseong’s existence is upended. Cheondong seems to attract attention wherever she goes, including that of Maseong’s charismatic (but maybe evil) boss, Phillip, and Phillip’s lecherous half-brother, Pilyeong. Who is Cheondong, why does she know so much about Maseong, and will they be able to work through more than five centuries of baggage and just fall in love already?"
3247,Tales of Sarimin the Jinn,Action,NAGATERBANG,SUNDAY,146,81128,9.55,1600000,240937,ONGOING,False,"Sarimin is a jinn (spirit) who specializes in helping people get what they want at the price of their soul. In recent times, he’s been down on his luck, with fewer and fewer people seeming to believe in the power of spirits. With the help of his trusted monkey, Tuyul (a money-obsessed baby spirit), and Wasa, a human soul doomed to be a servant for eternity, Sarimin attempts to get back on his feet and adapt to the modern world. In Sarimin, we follow the titular character as he attempts to tempt a new generation of humans."
2446,Jackson's Diary,Supernatural,Paola Batalla,SUNDAY,140,1100000,9.7,107800000,10700000,HIATUS,False,"The year is 1989, and Jackson is starting his senior year at a brand new school. Even though he's back in his hometown with his new family, he can't seem to shake this ominous and uneasy feeling invading his mind. It's not until he meets the popular kid, Exer, that reality starts to feel more like the work of his imagination."
3918,My In-Laws are Obsessed with Me,Fantasy,"seungu, Han Yoon seol",SUNDAY,130,1800000,9.81,172600000,14200000,HIATUS,False,"Pereshati Jahardt is a count's daughter who got remarried after her mother’s passing. When her father died, he left her all his fortune. Then, Pereshati's greedy stepmother and stepsister conspire with Pereshati's lover to kill her. However, under mysterious circumstances, Pereshati is brought back to life and travels back in time before her murder. To buy some time before getting her revenge, Pereshati visits the handsome yet notorious grand duke, Therdeo Lapileon, to marry him. During her visit, she uncovers a horrifying secret of his family. How will Pereshati deal with it? Will she be able to take her revenge?"
6211,The Heavenly Demon's Descendant,Fantasy,"Jung seonyul, Yuon Im",SUNDAY,39,129715,8.58,2600000,190229,HIATUS,False,"The once up-and-coming monster hunter Suho has plateaued at B Class, dashing his hopes of ever avenging his parents' deaths. Enter the ghost of the Cheonma, former divine Murim master and Suho's direct ancestor! Fortunately for Suho, the disembodied Cheonma needs a body to hunt down his arch nemesis, the Blood Demon, and Suho is the perfect fit. Will Suho strike a deal with the Cheonma to escape his rut and gain the power to finally avenge his parents?"
2724,Vibe Check!,Comedy,Ucheomaaa,"THU,",148,82198,9.56,4900000,794753,HIATUS,False,"Uche's very bad day only gets worse when an inter-dimensional dudebro drops down from the heavens to turn his life upside down. Apparently Uche's vibes are so cosmically wack that they can be seen from outer space, and now the Vibe Fairy has made it his mission to beat a sense of purpose back into him. Together with his new, alarmingly ripped guide, Uche will have to tackle life's great challenges and learn to love himself, or die trying. Possibly both."
2383,Blades of Furry,Romance,"Deya Muniz, Emily Erdos",SUNDAY,85,529968,9.51,44100000,4000000,HIATUS,False,"Emile is an up-and-coming skater in the beloved sport of Skate Battles, a high-stakes combo of figure skating and martial arts. Radu is a well-known senior skater and several time champ with the world at his feet. However, during an ill-fated match between the two, Emile discovers Radu's secret, which could threaten to destroy him. Will Emile keep his secret? Or could this rivalry turn into something more...?"
5965,Love or Attraction,Romance,"Yuu, Myeong",SUNDAY,34,67937,8.1,2100000,136453,HIATUS,False,"Is it truly love without physical attraction? Byeol dumped her boyfriend after a disappointing night in the bedroom, whereas Gyeol  got dumped for being ""too much.""
 
These two, with clashing ideas about love, are set together to work on the student council. Will their misunderstandings only deepen the rift between them, or will they come to learn from each other?"
1499,Castle Swimmer,Fantasy,Wendy Lian Martin,SUNDAY,186,3000000,9.84,336500000,27200000,HIATUS,False,"What happens when your entire life is ruled by a prophecy – your future foretold by people you’ve never met, who died long before you were born.  Such is the story of two young sea creatures.  One believed to be a guiding light for his people, a Beacon who will lead them to a bright, prosperous future.  The other is a teenage prince for who’s destiny is to KILL the Beacon so that HIS own people might thrive.  When both reject the course set for them, it leads to a raucous adventure as big and unpredictable as the ocean itself – and a romance that nobody could have predicted."
1490,Blood-Ink,Action,Lupicut,SUNDAY,142,676378,9.64,56500000,5200000,HIATUS,False,"In the Republic of Terragua, being an assassin is not only legal, but quite profitable if you play your cards right. It’s as simple as accepting a Blood-Ink, taking out the target, and getting paid. As long as you follow the rules and pay your taxes on time, there shouldn't be any problem at all. At least, that's what Maya thought until she met Rama, an unlicensed assassin with a thirst for vengeance…"
2706,Smity and Majesty,Comedy,Nekucciola,SUNDAY,169,177894,9.44,13800000,2100000,HIATUS,False,"Sparks fly when bumbling Prince Vain meets the enemy kingdom's royal blacksmith, Valka Voima. He might be visiting to broker peace, but that's all about building relationships, right? If only Valka would actually talk to him... Lucky for Vain, after a world-shaking theft threatens the fragile treaty between their kingdoms, the starcrossed Smity and Majesty are stuck on a run together! Will they be able to survive the shenanigans headed their way, or will they kill each other first?"
1881,The Shadow Prophet,Drama,"Anne Delseit, Marissa Delbressine",SUNDAY,60,93087,9.57,2100000,354121,HIATUS,False,"The Great Prophet Godo has a place for everyone in his perfect society… so long as you aren't a failure. Itshou is living a diligent and sheltered life when she suddenly finds herself denounced and marked for exile. While her beliefs are shaken to their very core, a chance encounter with a childhood sweetheart derails Itshou’s banishment and puts her on the path to political uprising. Now facing down the same forces she once trusted to protect her, Itshou must untangle the web of lies at the heart of her city and unmask the Shadow Prophet."
5516,Made of Stardust,Fantasy,Kalisami,SUNDAY,42,541866,9.48,14200000,1400000,HIATUS,False,"Kalisa is a young star who has fallen from the heavens and finds herself in an entirely new world where she is held captive by a young king. All alone and with no memory of her past, Kalisa escapes from the kingdom to find a way back home. With the help of new friends that she meets along the way, Kalisa embarks on a journey to break the curse she's under and return home to the stars. However, will she be able to do all this before the king finds her?"
1697,I'm the Grim Reaper,Supernatural,GRAVEWEAVER,SUNDAY,203,1900000,9.78,153400000,13700000,HIATUS,False,"On earth there are bad people, and then there are REALLY BAD people. If you’re one of the latter, you don’t just get sent to Hell, you get sent to Hell and get assigned a job collecting the souls of some of the worst people on Earth. Such is the career path of a young woman named Scarlet, who dies and is delivered down to the fiery underworld only to find herself in an entry level position as…The Grim Reaper!"
5968,23:4,Supernatural,TerraTerrific,SUNDAY,23,89391,9.38,1300000,145224,HIATUS,False,"As an angel of death, Eden is tasked with fetching human souls and leading them to judgement before they can transform into monstrous creatures known as Unresteds. He hopes his job will be easier when Celestino joins the crew, but the aspiring angel of music has other goals and refuses to cooperate. With the Unresteds growing stronger by the day, Celestino, Eden, and the other death angels must work together or face the same fate as their predecessors."
5113,Isabela,Fantasy,Plnt Senta,SUNDAY,23,142235,9.47,2300000,196093,HIATUS,False,"Somewhere called Isabela, we 'lived' and 'existed'. A seemingly endless life. Life, does it need to have any meaning? Or do we simply exist?"
3347,Metro Hunter,Action,"YOPY, Mr.Cheok",SUNDAY,85,132996,9.71,6400000,683147,HIATUS,False,"Unidentified monsters have taken over the metro lines of Seoul, bringing chaos to the city. In the 20 years since the monsters emerged, a system of hunters has been built in order to deal with the monster dungeons that have formed all over the city. One such hunter, Kang Cheol -- the Metro Hunter -- is on a journey to find and slay a monster he calls the “Master of Fire.”"
2831,The Wildlands,Fantasy,littlebobler,SUNDAY,27,72210,9.36,1100000,119610,HIATUS,False,"While scavenging the outskirts of the Wildlands, Athemis discovers a unique compass that points deeper in.
Together with her friend Erri, she decides to explore the mysteries behind the curious compass and its destination.
But an object that valuable doesn’t go unnoticed for long.
Its very existence threatens to shatter the already fragile peace of the citizens inside the magic barrier, who are on the brink of a civil war.
As interests surrounds Athemis and Erri, they will not only face danger from the treacherous Wildlands outside the Barrier, but also from the chaos within."
5594,Chasing Red,Romance,"SilentMaru, Isabelle Ronin",Released,5,522448,8.47,22800000,1500000,COMPLETED,True,"College heartthrob Caleb Lockhart is the last person a girl like Veronica Strafford should be involved with. Ambitious and fiercely independent, Veronica refuses to be the campus player's next conquest, even after a chance encounter sparks an undeniable attraction between them. But after she’s evicted with nowhere else to go, Veronica finds herself leaning on someone else for the first time. Caleb has never wanted someone like this before and he's determined to pursue her, even as the secrets of their pasts threaten to break them apart."
4572,Marry My Husband,Romance,"sungsojak, LICO",Released,7,2500000,9.66,166700000,10700000,COMPLETED,True,"When Jiwon, a 37-year-old cancer patient, walks in on her husband and best friend, she realizes her whole life has been a lie. What’s worse, she dies a tragic death at the hands of her husband. Would things have been different if she had made different choices? Fortunately for Jiwon, she is given the chance to rewrite her fate when she is reincarnated as her younger self. This time, she vows to live a happy life. But first comes revenge. Her plan? To marry off her now former best friend to her lying, cheating husband."
1320,Lore Olympus,Romance,Rachel Smythe,Released,9,6600000,9.58,1400000000,72400000,COMPLETED,True,"Witness what the gods do…after dark. The friendships and the lies, the gossip and the wild parties, and of course, forbidden love. Because it turns out, the gods aren’t so different from us after all, especially when it comes to their problems. Stylish and immersive, this is one of mythology’s greatest stories -- The Taking of Persephone -- as it’s never been told before."
5720,The Return of Elena the Knight,Romance,"Lee Harin, HaneulMireu",Released,3,229188,7.97,8600000,828796,COMPLETED,True,"Elena Blaise grew up as a count’s daughter in a royalist household backing Crown Prince Carlisle. The prince’s sudden assassination makes way for the Anti-King Paveluc, who annihilates House Blaise overnight. As the sole survivor, Elena trains as a knight to avenge her family. When she finally faces off with Paveluc, a deadly blow not only knocks her unconscious but also catapults her into the past! Elena wakes up one year before the fall of House Blaise. Determined to protect her kin, she rushes to save Crown Prince Carlisle, asking for his hand in marriage and offering her services as his knight. Bewildered as he is, Carlisle takes the bait. The future now lies in the hands of his fiancée fighting on his behalf!"
4047,To The Stars and Back,Slice of life,Peglo,Released,8,1100000,9.77,145400000,14100000,COMPLETED,True,"Introverted and grumpy, 20-year-old Kang Dae spends the majority of his time alone, and he prefers it this way. One day, he gets a very friendly and bubbly neighbor named Bo Seon. Suddenly, his life takes a very different turn."
