title_id,title,genre,authors,weekdays,length,subscriber,rating,views,likes,status,daily_pass,synopsis
3453,The Druid of Seoul Station,Action,"liveBear, Mun sung ho, Jin Seol woo",THURSDAY,171,692655,9.32,62900000,5000000,ONGOING,False,"What started out as an ordinary day turned upside down when an unknown catastrophe struck Earth, transporting Suho Park to a different planet. He eventually learns how to adapt and fight for his survival in this foreign world, but one day, just as suddenly as he was sucked into this new planet, Suho is pulled back to Earth. He quickly learns that return to life as he remembers it is no longer possible, as Earth is in constant battle with monsters who’ve managed to infiltrate the planet. How will Suho fight against the monsters attacking Earth, and will he be able to survive this time with his current skills?"
6881,Seasons of Lovesome,Romance,"HONGDUCK, NEMONE",THURSDAY,25,197949,9.87,3300000,474838,ONGOING,False,"Life isn’t always perfect, but love certainly makes it better. The exciting tale of young love continues a year following the story “Seasons of Blossom.” Bomi and her university classmate Pureum’s lives center around a new place, “Cafe Blossom & Nemone Art Studio,” as they navigate the joy and hardships of university and professional life."
6148,The Executioner,Action,"Lee Jehwan, Park Bumjin",THURSDAY,47,303057,9.52,8300000,653050,ONGOING,False,"A hero should never kill anyone, not even the worst of villains.
Gangyu could never understand why his team of heroes lived by those words, but he tried his best to do the same… until the villain who wiped out his squad killed his brother in prison.
Gangyu breaks his vow and enters Ruculus with permission to kill as the prison’s executioner. Now, he must fight his way through the villains to kill the worst of them all."
7292,High School Queen,Drama,"critie, Nehae",THURSDAY,14,144286,9.27,1800000,189936,ONGOING,False,"Cheongha Kim, a legendary swordswoman from the Joseon era, awakens centuries later in the body of Dajin Park, a quiet high school student. Armed with deadly combat skills, Cheongha must face school bullies, navigate the chaos of modern-day life, and find her place in a world far different from her own. The halls of Juwon High are about to meet a warrior unlike any they’ve seen before.
The series contains themes regarding bullying and violence that may not be suitable for all readers. Viewer discretion is advised."
1895,City of Blank,Sci-fi,66,THURSDAY,209,740746,9.69,53500000,7500000,ONGOING,False,"In a world where ghostly Blanks can steal your face – and your life – at any moment, a young boy named Rex hunts for his brother’s killer. Cursed with the unique power to physically touch Blanks, Rex starts to uncover darker secrets at the city’s center and in his own past. Will Rex unmask the killer, or will he become just another faceless victim in the City of Blank?"
5816,Killer Peter,Action,"Kim Junghyun, Lim Lina",THURSDAY,71,377145,9.74,16900000,1300000,ONGOING,False,"After devoting his life to the crime organization, Glory Club, Peter retires his status as a legendary killer and spends his remaining days running a quiet used bookstore. But after being ambushed and nearly killed one day by the very organization he dedicated his life to, Peter finds his body magically reverted back to its teenage years. Now that Peter was back to his peak physique, he sets out to settle the score with Glory Club."
7370,The Roguish Guard in a Medieval Fantasy,Fantasy,"gomdol-ineun, kimgarden, Studio MW, WM",THURSDAY,10,63264,9.45,499039,51797,ONGOING,False,"In a brutal medieval world where innocence means life and guilt means death, Aron, captain of the castle guard, enforces order within the fortress. But when demons begin to corrupt men’s hearts, violent events erupt, including repeated attempts to assassinate the lady of the castle. As Aron hunts the culprits, he encounters a demon that marks him, granting incredible strength but tainting his body with dark magic. Now, with his mind clouded and powers growing, Aron must unravel the mystery before the castle and his soul fall to ruin."
4153,Best Teacher Baek,Action,"ORIBORI, Team the JICK, Ganjjajang",THURSDAY,101,346568,9.81,25100000,2300000,ONGOING,False,"Once the finest instructor in the Blood Cult, Suryong Baek is killed, only to to wake up in the body of someone who teaches martial arts at a small rural academy. His new body may be weak, but he knows how to fix it, and it’s not the first time that he’s found himself in a body that can’t access its inner power. Curing his body requires money, however, and Suryong decides that becoming the greatest instructor at a top academy is the best way to do it. Since he’ll be up against tough competition, Suryong will have to use everything he’s got to become a teaching superstar."
6995,Back to Chanbi,Romance,jang sawhee,THURSDAY,22,144697,9.37,2400000,187542,ONGOING,False,"Gyeono Kang, a lucky high schooler, used to enjoy the mutual love he shared with the prettiest girl in his class, Chanbi Baek. She was always all about him until an accident wiped her memories of the past year, and just like that, she no longer had feelings for him. But what about Gyeono, whose heart still beats for her? Is it even possible to win her back? Did she really like him back to begin with?! Somebody help!"
4583,Kill the Dragon,Action,"Miss Jisu, J-Sun(REDICE STUDIO), Baeksu Noble",THURSDAY,127,311856,9.32,20900000,1800000,ONGOING,False,"The human race plunged into a war against dragons, who have invaded the earth! At the same time, among the humans arose people with supernatural powers, called psykers. Through the countless sacrifices of psykers, the war seemed to be coming to an end with the human race as the victors. But when a psyker with the ability to see the future foretold that the dragons will be returning in 15 years, the people established Ark, a facility to train children born with psychic abilities to prepare for the last war of the human race. There are only three years remaining until the prophesized war. What will happen next?!"
7357,A Flower Blooms on the Wall,Romance,"Eunjeong, Myeonla, Park Yeong",THURSDAY,13,123089,9.08,1200000,86900,ONGOING,False,"“Of course I recognized you. You’re my first love.” Living a life of being stalked by her first love, Dam Do is visited by her brother’s friend Yun Oh. No longer the boy next door who used to follow her around like a puppy, Yun is now a man, and he acts strangely aloof around her. While Dam has found herself resenting her first love, Yun is secretly quite excited to be around his first love once again. As the two become reacquainted after their time apart, they may be in for a lesson on what love really is."
6244,K.O!,Romance,Sable Studio,THURSDAY,49,155133,9.54,4300000,449001,ONGOING,False,"Seen as a problematic high school student, Joel Mora is feared by all. That is, until Emma, a shy girl from his class, decides to get to know him better. Now, Joel is in the middle of a social whirlwind, trying to find his place."
7007,The Villainous Tyrant has Returned,Fantasy,"Studio wooridle, Jepure",THURSDAY,17,150246,8.82,1800000,161773,ONGOING,False,"Was there ever a greater tragedy than love turned to hate? Such is the tragic downfall of Emperor Ludwig of Berzantium, as he is betrayed and murdered in a fiery blaze by his empress. Olive Charleterre was once a bright young debutante, until her spirit was broken by the emperor’s cruelty. Yet when Ludwig opens his eyes, he finds he has been sent back in time to his childhood. Whether he uses this boon to reclaim his lost love and forge a new path away from his villainous future -- only time will tell."
5986,Night of the Goblin,Action,"munsik, dool",THURSDAY,61,172774,9.24,6200000,450161,ONGOING,False,"Until just a few days ago, Siu Choi was your typical high school student. But suddenly he finds out he’s a descendant of the goblin clan, and thus a half-demon.
In a dark realm of another world there lives the Demon King, the demon who rules over the night and reigns over all demons of the world.
Now, the fight for the throne begins."
853,Adventures of God,Comedy,"Teo, Corey","TUE,",926,1600000,9.38,505700000,34900000,ONGOING,False,"In this slice of (eternal) life, you'll meet God, visit Heaven and learn that what goes on behind the pearly gates isn't exactly the way the good book describes it.  For starters, it's a pretty unhealthy work environment - what with God's ginormous, fragile ego and heavy drinking problem. The good news is that while heaven is a lot less holy than expected, it's much more hilarious too."
6281,Wanna be Friends?,Romance,Giushia,THURSDAY,47,129317,9.64,3500000,340105,ONGOING,False,"Sienna has never been great at making friends. But it’s a new year and a new school, and she’s not going to repeat the mistakes of the past! She’s going to make whole new mistakes as she crashes headfirst into the most popular ice king at school, Ian. The famous student keeps himself closed off from others, but Sienna’s unorthodox methods of making friends will give him more than one heart attack…and maybe…a crush?"
6299,The Fish I Loved,Romance,"WUJUBOMBOM, BUBAL, WOODO, HONG EUN-AE",THURSDAY,48,231324,9.48,6400000,649091,ONGOING,False,"Yana Jeong, a typical girl, runs into a strange man who’s out of breath during one of her part-time jobs. Little did she know that this was Kai Shim, the son of the CEO of a large jewelry corporation called Inoroo, who also happens to be a merman. Yana coincidentally runs in Kai again when she ends up working as a waitress at his birthday party, where a series of accidents lead to the two of them meeting each other again. Will Yana be able to keep up with these unexpected events happening one after another?"
6693,The Password Is 002!,Romance,PADO,THURSDAY,30,110956,9.6,2800000,239438,ONGOING,False,"The night before Sujeong plans to confess her feelings for Dojin, she runs into him on the street and is devastated to find out that he doesn't even know her name. Too afraid to face him in class the next day, Sujeong hides in the storage locker, where she meets Dojin's younger brother Jaeyun. With Jaeyun's help, will she able to win Dojin's heart?"
4526,Lady Liar,Romance,Maripaz Villar,THURSDAY,95,147211,9.72,6700000,1300000,ONGOING,False,"Adara, a lower class girl whose only love is money, comes up with the perfect plan to get her dream job: she’ll pretend to be a refined lady to be hired as a companion for a wealthy family.

The job seems easy and everybody believes she’s the lady she claims to be… except for one person. Always at risk of being exposed, Adara discovers that surrounding herself with lies and pursuing her dreams with her heart untouched will be harder than she thought."
6695,The Dang Clan's Swordmaster Heir Just Wants a Normal Life,Action,"Hwagye, SUPJA, PSG",THURSDAY,32,67445,8.94,1800000,151856,ONGOING,False,"The Dang clan of Sacheon, once renowned for its poison and hidden weapons, is now on the path to its demise.
That is, until Yeonmyeung Dang, an outcast boy of the clan, awakens by recollecting the memories of his past life
as the 'god of swords' who devoted his life to mastering the sword.

Will the boy be able to protect his family and fulfill his dream of living a normal life?"
6994,The Masters Have Subscribed,Action,"DN, kangho HA, KIM KI BAEK",THURSDAY,21,59588,9.21,1000000,97372,ONGOING,False,"“Cheong-un, parry the attack! Move faster or the obstacle course will kill you!”
The progenitors of the great Wudang sect and the mighty Shaolin encounter post-ascension issues when they find themselves reduced to servants in the godly realm. Their only hope and escape from their divine chores lie in the hands of less-than-average Cheong-un, who can hardly beat his peers in the sect.
Can the masters raise an average boy into a master of martial arts and finally relieve themselves of their menial chores?"
6998,You Just Made My Day,Romance,yejo,THURSDAY,13,85251,9.46,1000000,76387,ONGOING,False,"The transfer student Yebom was jealous of Eunho, an honor student everyone liked. Many years later, Yebom’s life feels hopeless and bleak when one day, she finally learns about the reason behind Eunho’s death that occurred a long time ago. Yebom, filled with regret, returns to the time when she was 18 and faces him once again. 
What drove the seemingly perfect boy to death? Yebom is finally ready to hear Eunho’s story. 


This series contains themes regarding suicide and bullying that may not be suitable for all readers. Viewer discretion is advised. If you or someone you know is struggling or in crisis, please reach out for help at Crisis Text Line (http://crisistextline.org/)."
5973,Mage and Mimic,Comedy,Feathermage,"MON,",88,95202,9.54,4600000,617310,ONGOING,False,"Muir the Mimic is tired of living her life in a dungeon. She wants to see the world and explore, and Rowan the Mage might just be her ticket out. But things are rarely that simple. When her goal is in reach a wicked curse tosses a wrench in things. But together maybe the Mage and the Mimic can find a way to have it all!"
4940,Sisters at War,Drama,Maenggi Ki,THURSDAY,90,268144,9.41,12700000,1500000,ONGOING,False,"What if your worst enemy turned out to be your sister? Dark loner Haera and golden child Li-on have always been arch rivals, competing to be the best in their arts high school. Of course, Li-on always seems to win, with the support and privilege provided by her wildly wealthy, world-famous sculptor mother. Then again, Li-on has dark secrets of her own, and there’s just something about Haera -- her authenticity and vision. Will Haera and Li-on ever make peace? After all, there can only be one when it comes to the real deal."
4353,My Dud to Stud Boyfriend,Drama,"YERANG, SUTGGI",THURSDAY,122,224016,8.39,16200000,1800000,ONGOING,False,"You just wait. I’ll find a boyfriend who’s WAY better than you!
After being dumped by her hot ex-boyfriend of two years, Sia is on a mission to find the ultimate boyfriend to join her on her NewTube Channel. To her dismay, however, Minho, an overweight, nerdy otaku who gets bullied at school, asks her out. Should she accept him as her boyfriend? Can she succeed in transforming this dud into a superstud?"
6019,Mono and Mochi,Comedy,omumoo,"MON,",119,122183,9.73,7100000,1000000,ONGOING,False,"Having a cat is a huge responsibility, especially if that cat is Mochi! Mochi is chaotic, unpredictable, and hard to control--but at the end of the day, Mono wouldn't trade him for the world."
400,Space Boy,Sci-fi,Stephen McCranie,THURSDAY,371,488473,9.84,91200000,8800000,ONGOING,False,"A girl who belongs in a different time. A boy possessed by an emptiness as deep as space. A story about an alien artifact, a mysterious murder, and a love that crosses light years."
6318,Want to See My Cat?,Romance,samtae,THURSDAY,45,136332,9.79,4200000,457940,ONGOING,False,"Chayeong Mun had the perfect life -- a peaceful life in the countryside with a loving husband, three cats who run the house, and two dogs who think they’re cats. One day, she goes into the city to meet her friends and dies while saving a student from being hit by a truck. The god in the afterlife gives her the incredibly rare chance to go back to her wonderful life, but only under the condition of going back 10 years in time. Given the second chance, Will she be able to marry her husband again and rebuild that perfect life she knew?"
7454,Combat Ward,Action,nodohwan,THURSDAY,7,31684,8.89,156914,11796,ONGOING,False,"Seonu Kang, a high school student, single-handedly takes down a group of illegal loan sharks who show up at his house. While being treated at the hospital, he encounters a mysterious man who offers him an invitation to a suspicious secret fighting tournament with a massive cash prize. 
The prize money is his only hope to save his family. Seonu must survive in the combat ward at all costs! Will he be able to defeat all other fighters and become champion?"
6466,King of the Arena,Action,"LICO, Kyeongchan Han",THURSDAY,41,98855,9.39,2800000,176850,ONGOING,False,"First-year Gilsu Lee transfers schools to run from the bullying and violence. And the new place seems almost perfect. Everyone in his class is friendly and kind, and no one is bullying anybody.
Violence? No, we don’t do anything like that in this school. That’s what the “Arena” is for.
Don’t forget, Gilsu. What happens in the ring stays in the ring!"
6882,Phantom Whispers,Thriller,moonkyoung kim,THURSDAY,22,78203,9.85,1100000,132266,ONGOING,False,"Noa has struggled with hearing unsettling voices since she was a child. But when a mysterious murder takes place, the voice in Noa’s head urges her to uncover the killer. With the police skeptical and her sanity on the line, Noa must navigate a web of fear and suspicion, guided by a ghost, to catch a ruthless killer before she herself becomes the serial killer. Will Noa uncover the murderer, or will her own mind betray her?

This series contains themes regarding mental health and violence that may not be suitable for all readers. Viewer discretion is advised. If you or someone you know is struggling or in crisis, please reach out for help at Crisis Text Line (http://crisistextline.org/)."
5812,Random Target,Romance,"INE, Yuhan",THURSDAY,70,179844,8.88,6900000,611246,ONGOING,False,"After the failure of her first love, Serin easily and quickly falls in love with any good-looking guy. Two days before her birthday, she gets dumped by her hot boyfriend, and her search for a man like the legendary unicorn continues. Little did she know, she'd meet a real unicorn on the virtual reality blind dating app called Random Target. Is this app the golden ticket to finding her true love?"
4761,Daedalus of the Crows,Fantasy,"Marco, Shinbross",THURSDAY,70,131326,9.4,3700000,326149,ONGOING,False,A mysterious boy with a dark past seals a deal with an eldritch crow-like being and gets thrown into a mortal game. Only one will survive and see their wish granted. Will he make it to the end of the labyrinth of the gods?
6531,The Demon King's Warrior Daughter,Fantasy,"Geobong Choi, Ppangbaksa, Jumeok",THURSDAY,39,132401,9.34,2700000,270902,ONGOING,False,"Nobody said being a parent was easy. It’s especially hard for Belphegor Verscios, the adoptive father of an exceptionally gifted human girl who insists on becoming a warrior someday and defeating the Demon King - who, unbeknownst to her, happens to be him. But when you’re a doting father like Belphegor, what else can you do but try to support her dreams while simultaneously making sure she never reaches her goal? It’s a fine line to walk, but he must succeed at any cost, or suffer the worst fate he could ever imagine… disappointing his daughter."
2751,Lily Crown,Action,Diggymungo,THURSDAY,81,111480,9.49,4500000,642630,ONGOING,False,"Escaping a political marriage and her glowing crown were just the start of Lilinae’s journey. Becoming the queen of Shootend, meeting her two knights, and braving hostile kingdoms to get back home — that’s where things get interesting."
3353,The Last Golden Child,Action,"Alkkae, Saemong",THURSDAY,175,190412,9.73,9900000,1200000,ONGOING,False,"How many kicks does it take to smash the heart of a giant? Though she’s not a pure Child of Golden Light, Loxy must learn to channel the sun’s warmth and topple the towering titans that stand in the way of saving her sister. With bloodthirsty giants in her path, and the ruthless God of the Gods, Odin, in hot pursuit, Loxy pushes her body to its very limits in the hopes that she can become half as strong as the sister that now desperately needs her help."
6852,A Life-Changing Turn,Thriller,"Gwang-jin, Ghna, YOPY",THURSDAY,17,49527,9.24,597944,61083,ONGOING,False,"My name is Sua Jo, and my life couldn't get any better - my loving dad is a Mayor, my handsome boyfriend is the top dog in school, my fun-to-be-with friends love me, and my background is top-notch. My life is perfect. But wait, did I just hit someone?! No, no I didn't... No one saw me, so nothing happened. My life is still perfect, or so I thought... until ""M"" appeared claiming to be a witness. You think I'll let you ruin my perfect life?! Just wait until I find you!"
6854,Tales of the Unusual 2,Horror,Seongdae Oh,THURSDAY,24,37335,9.81,748805,96185,ONGOING,False,"From twisted games of evil demons and the roaming of the undead to strange technology that makes the impossible happen, dive into Tales of the Unusual 2, another thrilling collection of supernatural horror stories that will have you scrolling for hours. With just the right balance of dark humor and the unexpected, each short story pulls you into a new immersive world and unravels plot twists you never would've imagined. Just remember, there's nothing to be afraid of... If you have nothing to hide."
5818,Take My Money,Romance,AlohaDRY,THURSDAY,71,83705,8.59,2900000,303552,ONGOING,False,"Prepare for some chaos as Miss Mina, a campus celebrity, stumbles upon her first love -- none other than the aloof senior who's as cold as an iceberg! She launches an extravagant mission, armed with both her heart and a bottomless wallet. Will her efforts and creative tactics crack his icy exterior?"
6744,Guardian Girl,Romance,MJ Kim,THURSDAY,29,35791,9.45,836520,88391,ONGOING,False,"An immortal highschool student, Soyeong is secretly crushing on human golden retriever Huijae. 
Mysteriously, he keeps coming into near-death danger and Soyeong repeatedly sacrifices herself to protect him. 
Something begins to grow between the two, and someone doesn't like that. What will happen to their lives and fate?!"
4519,Dungeons & Dentists,Fantasy,Tricia Rose,THURSDAY,43,57212,9.18,1500000,219529,HIATUS,False,"There’s no tooth too big, no cavity too small for Sandy Smyles, pediatric dentist extraordinaire. She’s confident she can handle it all… until a large green jerk storms in claiming he’s going to conquer her world. Is he in cosplay? Is he... an actual orc? Either way, Sandy is going to have to take on her biggest case yet: saving Earth!"
4180,Dreaming Freedom,Romance,2L,THURSDAY,5,1000000,9.59,39900000,3400000,ONGOING,True,"Jeongmin is a loner in high school being bullied by the Queen Bee, Juhyeon. The two were friends in elementary school before their friendship ended because of Juhyeon’s demand that Jeongmin should only be friends with her. Juhyeon uses this “betrayal” to fuel the classmates' insults and isolate Jeongmin in misery. Jeongmin has only one way to escape, through lucid dreams. One day, a mysterious man enters her dreams and offers to help her get revenge on Juhyeon…"
6130,Onsaemiro: Never Changing,Fantasy,"YeoWoo, SaMoon",THURSDAY,57,198730,9.23,4000000,348841,ONGOING,False,"Haeri Jin is an aspiring actress who hasn't had the best of luck.  But this time, she has a good feeling about the show she's about to audition for. Since it's a period piece, she decides to stop by a historical museum and comes across a beautiful incense burner from the Baekje era. Mesmerized, she prays for good luck, but little does she know that she has awoken a god named Onsaemiro who was trapped in the incense burner. How was she able to free him? Because she is the reincarnation of a princess of Baekje who was once Onsaemiro's lover...!"
2730,Cloud Walker,Action,kariyeen,THURSDAY,121,281494,9.34,10400000,1100000,ONGOING,False,"Arais: demons that prey on weak-minded humans, plunging their victims into despair and taking control. A selected few of humans who possess supernatural abilities, under the organization of Cloud Walker, are the only ones who can deal with them. Through an unfortunate encounter with an Arai, Kai Wattana is forced to make a deal with one of these demon himself... or is it the other way around?"
2876,A Man's Man,Drama,"Dogado, Lucas, Ha Neulso",THURSDAY,195,134312,9.86,10300000,1300000,ONGOING,False,"Yuhyeon becomes the youngest CEO of Hansung, a successful electronics company built on toxic work culture, but nobody he cares about is there to celebrate with him. After a night of drinking and wondering if he could change the past, he wakes up the next morning, 20 years younger at the beginning of his career. Armed with the experience and insights that made him CEO, Yuhyeon begins to revisit broken relationships and battle the enablers of Hansung’s cut-throat work environment. But he does not yet know how changing the past will affect his future..."
6410,My Crush Got Possessed by the Duke,Fantasy,"Dadam, Juksoon",THURSDAY,43,112007,9.16,2000000,202131,ONGOING,False,"So-a knows that having a crush on a childhood friend can be complicated, but it’s even harder when he gets possessed by… the duke?! When So-a’s friend Yuseong is suddenly possessed by Duke Hereis De Licariel, they must figure out a way to get Hereis back home -- which is easier said than done when Hereis sounds like he came straight out of a fantasy novel! Can So-a get her childhood friend back while having to juggle academics, sports, and a duke who also happens to be a swordmaster?"
6889,Enoch: The Shining Tree,Action,Chiroyugo,THURSDAY,23,44820,9.3,533224,60899,ONGOING,False,"""You shall live and suffer for eternity, trapped within your armor, prisoners of time.""
Enoch's life is turned upside down when his entire family is slaughtered overnight by the cursed knights.
The knights wander, sentenced by the witch's curse to a fate of endless empty slaughters.
Enoch trampled under their trail of blood, burns for a vengeance that outlasts, outdoes eternity.
Who will be whose fate? Who is the one that orchestrates their conflicting fates?"
